"Disabling certificate validation","Disabling cryptographic certificate validation can cause security vulnerabilities.","error","Disabling certificate validation is strongly discouraged.","/src/client.js","129","3","129","27"
"Incomplete string escaping or encoding","A string transformer that does not replace or escape all occurrences of a meta-character may be ineffective.","warning","This replaces only the first occurrence of ""%"".","/client/js/libs/handlebars/parse.js","73","19","73","45"
"Incomplete string escaping or encoding","A string transformer that does not replace or escape all occurrences of a meta-character may be ineffective.","warning","This replaces only the first occurrence of '\\'.","/client/js/libs/moment.js","1064","56","1064","68"
"Incomplete string escaping or encoding","A string transformer that does not replace or escape all occurrences of a meta-character may be ineffective.","warning","This replaces only the first occurrence of '*'.","/client/js/libs/socket.io.js","1286","12","1286","27"
"Unsafe expansion of self-closing HTML tag","Using regular expressions to expand self-closing HTML tags may lead to cross-site scripting vulnerabilities.","warning","This self-closing HTML tag expansion invalidates prior sanitization as [[""this regular expression""|""relative:///client/js/libs/jquery.js:4888:14:4888:86""]] may match part of an attribute value.","/client/js/libs/jquery.js","5089","34","5089","71"
"Unsafe expansion of self-closing HTML tag","Using regular expressions to expand self-closing HTML tags may lead to cross-site scripting vulnerabilities.","warning","This self-closing HTML tag expansion invalidates prior sanitization as [[""this regular expression""|""relative:///client/js/libs/jquery.js:4888:14:4888:86""]] may match part of an attribute value.","/client/js/libs/jquery.js","5289","13","5289","51"
"DOM text reinterpreted as HTML","Reinterpreting text from the DOM as HTML can lead to a cross-site scripting vulnerability.","warning","[[""DOM text""|""relative:///client/js/libs/jquery/bootstrap.js:381:13:381:42""]] is reinterpreted as HTML without escaping meta-characters.","/client/js/libs/jquery/bootstrap.js","285","70","285","74"
"Missing rate limiting","An HTTP request handler that performs expensive operations without restricting the rate at which operations can be carried out is vulnerable to denial-of-service attacks.","error","This route handler performs [[""a file system access""|""relative:///src/server.js:75:9:86:3""]], but is not rate-limited.","/src/server.js","19","8","19","12"
"Incomplete URL scheme check","Checking for the ""javascript:"" URL scheme without also checking for ""vbscript:"" and ""data:"" suggests a logic error or even a security vulnerability.","warning","This check does not consider data: and vbscript:.","/client/js/libs/handlebars/parse.js","39","7","39","38"
