"Hard-coded credentials","Hard-coding credentials in source code may enable an attacker to gain unauthorized access.","warning","The hard-coded value ""blahfaceauth"" is used as [[""authorization header""|""relative:///spec/proxy.spec.js:316:44:316:57""]].","/spec/proxy.spec.js","316","44","316","57"
"Hard-coded credentials","Hard-coding credentials in source code may enable an attacker to gain unauthorized access.","warning","The hard-coded value ""blahfaceauth"" is used as [[""authorization header""|""relative:///spec/proxy.spec.js:333:44:333:57""]].","/spec/proxy.spec.js","333","44","333","57"
"Reflected cross-site scripting","Writing user input directly to an HTTP response allows for a cross-site scripting vulnerability.","error","Cross-site scripting vulnerability due to [[""user-provided value""|""relative:///lib/controllers/proxy.js:66:31:66:37""]].","/lib/controllers/proxy.js","101","45","101","86"
"Reflected cross-site scripting","Writing user input directly to an HTTP response allows for a cross-site scripting vulnerability.","error","Cross-site scripting vulnerability due to [[""user-provided value""|""relative:///lib/controllers/proxy.js:66:31:66:37""]].","/lib/controllers/proxy.js","137","34","137","90"
"Reflected cross-site scripting","Writing user input directly to an HTTP response allows for a cross-site scripting vulnerability.","error","Cross-site scripting vulnerability due to [[""user-provided value""|""relative:///lib/controllers/share.js:207:22:207:34""]].","/lib/controllers/share.js","214","41","214","79"
"Missing rate limiting","An HTTP request handler that performs expensive operations without restricting the rate at which operations can be carried out is vulnerable to denial-of-service attacks.","error","This route handler performs [[""authorization""|""relative:///lib/makeserver.js:67:24:67:37""]], but is not rate-limited.","/lib/makeserver.js","66","17","66","42"
"Uncontrolled data used in network request","Sending network requests with user-controlled data allows for request forgery attacks.","error","The [[""URL""|""relative:///lib/controllers/proxy.js:189:30:189:50""]] of this request depends on [[""a user-provided value""|""relative:///lib/controllers/proxy.js:66:31:66:37""]].","/lib/controllers/proxy.js","187","42","194","22"
