"Prototype pollution in utility function","Recursively assigning properties on objects may cause accidental modification of a built-in prototype object.","warning","Properties are copied from [[""options""|""relative:///public/js/vendor/jquery.js:344:18:344:24""]] to [[""target""|""relative:///public/js/vendor/jquery.js:368:6:368:11""]] without guarding against prototype pollution.","/public/js/vendor/jquery.js","368","6","368","11"
"Incomplete string escaping or encoding","A string transformer that does not replace or escape all occurrences of a meta-character may be ineffective.","warning","This does not escape backslash characters in the input.","/public/js/vendor/jquery-ui.js","8765","19","8765","30"
"Unsafe expansion of self-closing HTML tag","Using regular expressions to expand self-closing HTML tags may lead to cross-site scripting vulnerabilities.","warning","This self-closing HTML tag expansion invalidates prior sanitization as [[""this regular expression""|""relative:///public/js/vendor/jquery.js:6024:14:6024:86""]] may match part of an attribute value.","/public/js/vendor/jquery.js","6176","13","6176","51"
"Unsafe expansion of self-closing HTML tag","Using regular expressions to expand self-closing HTML tags may lead to cross-site scripting vulnerabilities.","warning","This self-closing HTML tag expansion invalidates prior sanitization as [[""this regular expression""|""relative:///public/js/vendor/jquery.js:6024:14:6024:86""]] may match part of an attribute value.","/public/js/vendor/jquery.js","6590","32","6590","69"
"Unsafe jQuery plugin","A jQuery plugin that unintentionally constructs HTML from some of its options may be unsafe to use for clients.","warning","Potential XSS vulnerability in the [[""'$.fn.datepicker' plugin""|""relative:///public/js/vendor/jquery-ui.js:7832:19:7865:1""]].","/public/js/vendor/jquery-ui.js","6861","9","6861","16"
"Unsafe jQuery plugin","A jQuery plugin that unintentionally constructs HTML from some of its options may be unsafe to use for clients.","warning","Potential XSS vulnerability in the [[""'$.fn.bottomless' plugin""|""relative:///public/js/vendor/jquery.bottomless.js:13:21:169:3""]].","/public/js/vendor/jquery.bottomless.js","31","22","31","36"
"DOM text reinterpreted as HTML","Reinterpreting text from the DOM as HTML can lead to a cross-site scripting vulnerability.","warning","[[""DOM text""|""relative:///public/js/vendor/selectize.js:2035:59:2035:95""]] is reinterpreted as HTML without escaping meta-characters.","/public/js/vendor/selectize.js","1847","16","1847","22"
"Missing regular expression anchor","Regular expressions without anchors can be vulnerable to bypassing.","warning","When this is used as a regular expression on a URL, it may match anywhere, and arbitrary hosts may come before or after it.","/lib/videos.js","166","33","166","74"
